created_at;id_str;full_text;quote_count;reply_count;retweet_count;favorite_count;lang;user_id_str;conversation_id_str;username;tweet_url
Sun Jul 30 04:56:36 +0000 2023;1685514709272018944;"Sepeda/motor listrik lebih bahaya soalnya ga ada suara sama sekali. Kalo motor masih ada jadi kalo papasan di gang lu bisa tau, "oh ada motor".";0;0;0;0;in;1560164945580265472;1685514709272018944;piecrro;https://twitter.com/piecrro/status/1685514709272018944
Sun Jul 30 04:56:01 +0000 2023;1685514562039414785;"@detikcom Sbnrnya g cm spd listrik, byk jg bocil2 seliweran dijalan pke motor sambil boncengin temennya, suka heran kok bs dikasi ijin am ortunya, smua itu ad waktunya, berkendara dijalan raya itu g sekedar hny bisa naiknya sj tp jg hrs udh sgt paham kondisi jalan &amp  pengguna jalan lainny";0;0;0;0;in;47124725;1685221124831895553;adejoon;https://twitter.com/adejoon/status/1685514562039414785
Sun Jul 30 04:53:41 +0000 2023;1685513974857789440;"@rcaoo_ @detikcom Ortunya blm dewasa anak kecil dibiarin keluar main malam2 sdh begitu pakai motor listrik pula";0;0;0;0;in;3234771411;1685221124831895553;sayainiarman;https://twitter.com/sayainiarman/status/1685513974857789440
Sun Jul 30 04:53:21 +0000 2023;1685513888916439040;"Sepeda/motor listrik yg dibawa ke jalan raya itu emang meresahkan banget sih terutama jalanan yg ramai";0;0;0;0;in;1203513800005079040;1685513888916439040;akaipinheel;https://twitter.com/akaipinheel/status/1685513888916439040
Sun Jul 30 04:44:41 +0000 2023;1685511710042726400;"@detikcom iya tuh, kesel gua mah sm ortu yg beliin anaknya sepeda listrik terus ngebiarin berkendara di jalan raya, pdhl anaknya masih pada SD! bahkan smpe pernah suka ngehambat pengendara motor/mobil";0;0;0;0;in;1291544278322176001;1685221124831895553;entrophymoon;https://twitter.com/entrophymoon/status/1685511710042726400
Sun Jul 30 04:42:52 +0000 2023;1685511254356717568;"yg punya motor listrik https://t.co/ehhRMG6uZE  Putri Ariani Islam Burung Syiah LGBT Jesslyn";0;0;0;0;in;1432129200136228865;1685511254356717568;AKomunikasi;https://twitter.com/AKomunikasi/status/1685511254356717568
Sun Jul 30 04:41:04 +0000 2023;1685510798603603968;"Punya Kapasitas Produksi 35 Ribu Unit per Tahun, Berikut 8 Bengkel Pelaksana Konversi Sepeda Motor Listrik di Jawa-Bali #TempoBisnis https://t.co/GkFEB1G2fW";0;0;0;0;in;18129942;1685510798603603968;tempodotco;https://twitter.com/tempodotco/status/1685510798603603968
Sun Jul 30 04:40:45 +0000 2023;1685510717733249024;"@CNNIndonesia Mau jualan motor listrik yg merusak bumi Indonesia dgn tambang batubara dan tambang nikel";0;0;0;3;in;62764791;1685460462073458688;nizaminz;https://twitter.com/nizaminz/status/1685510717733249024
Sun Jul 30 04:32:53 +0000 2023;1685508740525772800;"bocil di jalan pake speda listrik terus temen nya nyusul pake motor listrik si grab. kacau kieu kolot na anjir 🤣🤣🤣🤣";0;0;0;0;in;73123457;1685508740525772800;n0chancetobloom;https://twitter.com/n0chancetobloom/status/1685508740525772800
Sun Jul 30 04:21:07 +0000 2023;1685505778290176000;"Gua juga pernah sampe turun dari motor gara2 marahin bocil naek sepeda listrik tapi jalannya zigzag sambil ketawa2 sama temen2nya";0;0;0;0;in;706008751233339392;1685505778290176000;Omach15_;https://twitter.com/Omach15_/status/1685505778290176000
Sun Jul 30 04:20:51 +0000 2023;1685505711089037312;"@detikcom akhirnya ada yg ketabrak. subsidi motor listrik tidak tepat sasaran";0;1;0;1;in;1440314249448886278;1685221124831895553;ttirusaru;https://twitter.com/ttirusaru/status/1685505711089037312
Sun Jul 30 04:14:02 +0000 2023;1685503995635511297;"Peminat Konversi Motor Listrik Naik, Mayoritas dari Pulau Jawa https://t.co/z9p6aZuvhh";0;0;0;0;in;1582972008479920129;1685503995635511297;BloombergTZ;https://twitter.com/BloombergTZ/status/1685503995635511297
Sun Jul 30 03:59:20 +0000 2023;1685500297320509440;"Hari ini liat cara ganti baterai motor listrik.  #TodayILearn #EverydayILearn";0;1;0;0;in;164185471;1685500297320509440;nadipta;https://twitter.com/nadipta/status/1685500297320509440
Sun Jul 30 03:59:06 +0000 2023;1685500236356325376;"Anak2 kecil yg bawa motor listrik memang meresahkan sih Mereka nih suka belok tiba2, gak liat kanan/kiri Belum lagi yg bawanya ngebut, ada yg pas belokan ngebut  Sepeda listrik nih harusnya ada batasan usia, ato ada izin khususnya gt";0;0;0;0;in;1353151142662860800;1685500236356325376;indbluesora;https://twitter.com/indbluesora/status/1685500236356325376
Sun Jul 30 03:55:24 +0000 2023;1685499305988345857;"orang tuanya kadang juga memperbolehkan, pas ditegur malah marah2 apalagi yg membebaskan anaknya make sepeda listrik ini ke jalan raya. nanti kalo ada kejadian yg disalahkan pengendara motor, padahal sudah berkali2 di himbau dilarang menggunakan sepeda listrik di jalan raya";0;0;0;0;in;446885049;1685499305988345857;engkauu_;https://twitter.com/engkauu_/status/1685499305988345857
Sun Jul 30 03:48:59 +0000 2023;1685497691684651008;"@kingkushim007 @detikcom Sepeda listrik bukan termasuk kendaraan bermotor, makanya ga disarankan dipakai di jalan raya yg ada kendaraan bermotor (motor, ataupun mobil dsb)";0;6;0;26;in;1671847379505647619;1685221124831895553;mr_mustadjr;https://twitter.com/mr_mustadjr/status/1685497691684651008
Sun Jul 30 03:45:11 +0000 2023;1685496734120923136;"@detikcom Tapi motor listrik sepeda listri itu gak berbunyi lo. Tiba2 udah nylonong aja. Hampir kena tabrak. Kesel banget";0;0;0;0;in;1516258795567316993;1685221124831895553;happy_venus07;https://twitter.com/happy_venus07/status/1685496734120923136
Sun Jul 30 03:37:10 +0000 2023;1685494716362870784;"Di kampung2 tuh bnyk bocil yg bawa motor listrik gini, suka kebut2an, awalnya dikira emg pada punya masing2 di ksh ortunya, tp trnyata ada yg nyewain 10rb/jam.";0;0;0;0;in;411208219;1685494716362870784;riseeenshine;https://twitter.com/riseeenshine/status/1685494716362870784
Sun Jul 30 03:36:26 +0000 2023;1685494535194066944;"Anakku juga minta dibeliin sepeda listrik ini tapi suamiku ngelarang. Bahaya, katanya. Sama aja kayak motor. Gara2 di komplek banyak anak yg naik sepeda listrik ini, jadi kepengen beli jg.";0;1;0;0;in;237363430;1685494535194066944;LeylaHana;https://twitter.com/LeylaHana/status/1685494535194066944
Sun Jul 30 03:32:29 +0000 2023;1685493539592077312;"Pengen motor listrik deh";0;0;0;0;in;1559864449183281152;1685493539592077312;novkentri;https://twitter.com/novkentri/status/1685493539592077312
Sun Jul 30 03:20:39 +0000 2023;1685490560713531392;"Nggak perlu ragu lagi nih untuk beli motor listrik karena SPKLU &amp  SPBKLU tersebar di seluruh indonesia dan kamu bisa dapet diskon 7 Juta loh #PakaiMolisYuk  Putri Ariani Burung Jesslyn Bakwan Dewa 19 Cilok Logo Twitter Bali https://t.co/I7h3dFNNJT";0;0;0;1;in;1566879374640828416;1685490560713531392;maevexael;https://twitter.com/maevexael/status/1685490560713531392
Sun Jul 30 03:20:05 +0000 2023;1685490418140733440;"Kini makin mudah loh untuk beralih ke motor listrik kamu bisa dapat diskon 7 juta, Yuk simak syarat dan ketentuan nya #PakaiMolisYuk  Putri Ariani Burung Jesslyn Bakwan Dewa 19 Cilok Logo Twitter Bali https://t.co/InxZyxeSdn";0;0;0;2;in;1615580976960405504;1685490418140733440;arabellaputri_;https://twitter.com/arabellaputri_/status/1685490418140733440
Sun Jul 30 03:20:03 +0000 2023;1685490412553916416;"Konversi Motor Listrik Cuma Butuh Waktu 48 Menit, Bagaimana Alur dan Persyaratannya? #TempoBisnis https://t.co/0tSxL81IG9";0;0;1;1;in;18129942;1685490412553916416;tempodotco;https://twitter.com/tempodotco/status/1685490412553916416
Sun Jul 30 03:19:28 +0000 2023;1685490266101501952;"Yuk cek syarat dan ketentuan berikut agar dapat diskon 7 Juta setiap pembelian sepeda motor listrik dan sekarang SPKLU, SPBKLU sudah tersebar diseluruh indonesia #PakaiMolisYuk  Putri Ariani Burung Jesslyn Bakwan Dewa 19 Cilok Logo Twitter Bali https://t.co/ZqyePv31Z5";0;0;1;1;in;1570757554908860417;1685490266101501952;Naurapss;https://twitter.com/Naurapss/status/1685490266101501952
Sun Jul 30 03:18:48 +0000 2023;1685490095175110657;"Motor listrik banyak banget keuntungannya loh selain diskon 7 juta sekarang SPKLU dan SPBKLU makin mudah loh di temui karena tersebar di seluruh indonesia #PakaiMolisYuk  Putri Ariani Burung Jesslyn Bakwan Dewa 19 Cilok Logo Twitter Bali https://t.co/Lv9ijXujUI";0;0;0;1;in;2986669838;1685490095175110657;squeezte;https://twitter.com/squeezte/status/1685490095175110657
Sun Jul 30 03:18:17 +0000 2023;1685489964556206080;"Nggak perlu khawatir lagi nih beli motor listrik karena kamu bisa dapat diskon 7 Juta setiap pembelian motor listrik simak syarat dan ketentuannya. #PakaiMolisYuk  Putri Ariani Burung Jesslyn Bakwan Dewa 19 Cilok Logo Twitter Bali https://t.co/vXnHLE11hp";0;0;0;1;in;784555574658756612;1685489964556206080;cruisefr;https://twitter.com/cruisefr/status/1685489964556206080
Sun Jul 30 03:17:40 +0000 2023;1685489812177137664;"Mantap banget nih sepeda motor listrik makin terjangkau dan kamu bisa dapat diskon 7 Juta simak syarat dan ketentuan berikut. #PakaiMolisYuk  Putri Ariani Burung Jesslyn Bakwan Dewa 19 Cilok Logo Twitter Bali https://t.co/grES5oQ25g";0;0;0;1;in;1632766895299661825;1685489812177137664;thisikooo;https://twitter.com/thisikooo/status/1685489812177137664
Sun Jul 30 03:17:29 +0000 2023;1685489765712531456;"@CNNIndonesia Mulai dagang motor listrik..noh private jet bill gates menyeburkan lbh byk emisi dr motor2 indo..konspirasi taek";0;0;0;3;in;1119959588;1685460462073458688;fuk_min;https://twitter.com/fuk_min/status/1685489765712531456
Sun Jul 30 03:17:03 +0000 2023;1685489657776316416;"Wah sepeda motor listrik makin terjangkau karena setiap pembelian motor listrik diskon 7 Juta yuk cek syarat dan ketentuan nya. #PakaiMolisYuk  Putri Ariani Burung Jesslyn Bakwan Dewa 19 Cilok Logo Twitter Bali https://t.co/uoeCyjKuR6";0;0;0;1;in;1542687248;1685489657776316416;chiaraaurellie;https://twitter.com/chiaraaurellie/status/1685489657776316416
Sun Jul 30 03:16:29 +0000 2023;1685489514461241344;"Wah sekarang beli motor listrik mudah banget Karena setiap pembelian sepeda motor listrik akan mendapatkan diskon 7jt simak Syarat dan Ketentuannya. #PakaiMolisYuk  Putri Ariani Burung Jesslyn Bakwan Dewa 19 Cilok Logo Twitter Bali https://t.co/u2JpgxYiSn";0;1;0;1;in;1624947242;1685489514461241344;clarettariella;https://twitter.com/clarettariella/status/1685489514461241344
Sun Jul 30 03:15:39 +0000 2023;1685489305299673089;"Buruan beralih ke motor listrik banyak banget keuntungan dan sekarang beli motor listrik dapet diskon Rp 7Jt cek syarat dan ketentuannya #PakaiMolisYuk  Putri Ariani Burung Jesslyn Bakwan Dewa 19 Cilok Logo Twitter Bali https://t.co/ptH9tDzTRU";0;0;0;1;in;636855255;1685489305299673089;cessaazzahraa;https://twitter.com/cessaazzahraa/status/1685489305299673089
Sun Jul 30 03:11:45 +0000 2023;1685488322704207872;"@detikcom Orang tua sekarang memang banyak yg gak siap jadi orang tua. Gak bisa didik anak cuma bisa gedein dan biayain aja. Bocil dikasih motor listrik itu sangat irresponsible.";0;1;0;2;in;2335942801;1685221124831895553;Ikhwanazis89;https://twitter.com/Ikhwanazis89/status/1685488322704207872
Sun Jul 30 02:40:00 +0000 2023;1685480330588000256;"Top News Koran Rakyat Merdeka  Hadirkan Uji Konversi Motor Listrik Keliling  Pemerintah Jemput Bola https://t.co/PoDziqopO3";0;0;0;0;in;1474011848118657029;1685480330588000256;_rakyatmerdeka;https://twitter.com/_rakyatmerdeka/status/1685480330588000256
Sun Jul 30 02:27:50 +0000 2023;1685477271094939648;"@CNNIndonesia Waah... esdm jadi spg motor listrik?";0;0;0;1;in;1650713205898088449;1685460462073458688;tqiya_nissa;https://twitter.com/tqiya_nissa/status/1685477271094939648
Sun Jul 30 02:22:34 +0000 2023;1685475944721788928;"TNI AD Borong Puluhan Motor Listrik Mirip Vespa untuk Prajurit: TNI AD baru-baru ini memborong 50 unit motor listrik Greentech VP. Motor yang desainnya mirip Vespa Sprint tersebut akan diberikan kepada prajurit dan PNS di lingkungan Kodam IX/Udayana. https://t.co/wezyDT8nFm https://t.co/e0cbAez9um";0;0;0;0;in;117686358;1685475944721788928;otosia;https://twitter.com/otosia/status/1685475944721788928
Sun Jul 30 02:17:06 +0000 2023;1685474570810388480;"Kemenhub menyediakan layanan pengujian sepeda motor listrik hasil konversi melalui mobil alat uji non statis berupa bengkel berjalan. https://t.co/IVkSa6eht0";0;0;0;2;in;23343960;1685474570810388480;kompascom;https://twitter.com/kompascom/status/1685474570810388480
Sun Jul 30 02:05:48 +0000 2023;1685471725746835456;"@CNNIndonesia Sembur pajak berapa T? Orang2 itu makan gaji dr pajak motor juga kan? Atau mau digiring pakai motor listrik yg usianya hanya 5 tahunan, terus limbah batere emang bukan persoalan lg?";0;1;0;3;in;801803263364317184;1685460462073458688;udir73;https://twitter.com/udir73/status/1685471725746835456
Sun Jul 30 01:55:47 +0000 2023;1685469203560833024;"@detikcom Sepeda listrik ?? Itu motor listrik .. kayuhan nya cuman pajangan doang ko";0;0;3;29;in;56410707;1685221124831895553;hilmanmunawar;https://twitter.com/hilmanmunawar/status/1685469203560833024
Sun Jul 30 01:13:07 +0000 2023;1685458468218830849;"ESDM Sebut Antrean Konversi Motor Listrik Capai 4.578 Pemohon https://t.co/1opHeHMm9w";0;0;0;0;in;118646322;1685458468218830849;Bisniscom;https://twitter.com/Bisniscom/status/1685458468218830849
Sun Jul 30 01:09:54 +0000 2023;1685457659175297024;"Artinya motor listrik / mobil listri akan meledak dg sendirinya karena cuaca panas";0;0;0;0;in;1134851203924316161;1685457659175297024;antros21;https://twitter.com/antros21/status/1685457659175297024
Sun Jul 30 00:49:04 +0000 2023;1685452416169426944;"Antrean Pemohon Konversi Motor Listrik Capai 4.578 Orang, Didominasi di Jawa #beritajogja #jogja #jogjaistimewa https://t.co/nrxs6vkCys https://t.co/28Z4LMaEO2";0;0;0;0;in;118371948;1685452416169426944;Harian_Jogja;https://twitter.com/Harian_Jogja/status/1685452416169426944
Sun Jul 30 00:46:10 +0000 2023;1685451685639192576;"Lagian emg sepeda listrik ini ngeri bgt pertahanannya rapuh :( kaya kesenggol dikit langsung oleng n jatuh.. soalnya namanya aja sepeda.. beda ama motor listrik yg bentuknya kek motor matic pada umumnya tp pake listrik.. tante ku punya, lupa namanya, tp gede kaya vario gt, kuat i";0;0;0;0;in;990471313;1685451685639192576;mariaisabela_a;https://twitter.com/mariaisabela_a/status/1685451685639192576
Sun Jul 30 00:22:35 +0000 2023;1685445748715114496;"Kementerian ESDM menegaskan jika motor listrik hasil produksi bengkel konversi non-resmi dianggap bodong dan tidak layak jalan https://t.co/lqG4fkEQng";1;0;1;3;in;23343960;1685445748715114496;kompascom;https://twitter.com/kompascom/status/1685445748715114496
Sun Jul 30 00:16:55 +0000 2023;1685444321762537472;"@detikoto Bukan sepi peminat tp kgk masuk list subsidi motor listrik 😂😂😂";0;0;0;0;in;123496277;1685212671988424704;meluncur;https://twitter.com/meluncur/status/1685444321762537472
Sun Jul 30 00:01:53 +0000 2023;1685440539947323392;"Ada barang baru. Sampe saya temui di kampung2 penyewaannya. "Katanya" ada yang sempet kesetrum terus mati. Udah jelas sepeda buat olahraga malah di kasih listrik padahal udah ada motor yang pake bensin. Dasar.";0;0;0;0;in;1322165962741739522;1685440539947323392;sidianwahyu;https://twitter.com/sidianwahyu/status/1685440539947323392
Sat Jul 29 23:45:04 +0000 2023;1685436308951621632;"Cek Sepeda Listrik Motor 48V Sepeda Listrik Dewasa Sepeda Motor Listrik Premium Mewah Model Terbaru 2023 dengan harga Rp2.988.000 - Rp6.266.000. Dapatkan di Shopee sekarang! https://t.co/40Ff9UqP9U https://t.co/evueyMmIvb";0;0;0;0;in;534119681;1685436308951621632;YusufYouOne;https://twitter.com/YusufYouOne/status/1685436308951621632
Sat Jul 29 23:41:22 +0000 2023;1685435378889793536;"@geloraco Pak @KawanLBP , motor listrik itu perubahan namanya, diharapkan untuk menjadikan lbh baik, apakah perubahan itu membohongi rakyat?";0;0;0;0;in;1661041817138368512;1685161593779433472;amelcewaw36645;https://twitter.com/amelcewaw36645/status/1685435378889793536
Sat Jul 29 23:29:05 +0000 2023;1685432287692034048;"aaaaaa lucu amayyyy dari tj duren ke cilandak naik ojol motor listrik";0;0;0;0;in;1058048675606224896;1685432287692034048;tidakmissu;https://twitter.com/tidakmissu/status/1685432287692034048
Sat Jul 29 23:21:27 +0000 2023;1685430365882830848;"Kemenhub menyediakan layanan pengujian sepeda motor listrik hasil konversi melalui mobil alat uji non-statis yang dapat berpindah-pindah tempat. Itu untuk mendukung ekosistem sepeda motor listrik nasional.  https://t.co/oqLAC9m9gD  #HarianDisway";0;0;0;1;in;1279248910276419585;1685430365882830848;HarianDisway;https://twitter.com/HarianDisway/status/1685430365882830848
Sat Jul 29 22:32:09 +0000 2023;1685417960285024256;"Mau Motor Listrik dari Jokowi? Begini Caranya - https://t.co/kzZSsIQ9oB #prabowo #prabowosubianto #prabowountuksemua https://t.co/Q8NcuBKO4l";0;0;7;0;in;1068101963059879936;1685417960285024256;AdrianaDaneen;https://twitter.com/AdrianaDaneen/status/1685417960285024256
Sat Jul 29 20:39:16 +0000 2023;1685389548908634112;"@jokowi @erickthohir @sandiuno Sudah urgent pak colokan PLN sewa dimana mana, mohon dikerahkan seluruh BUMN memfasilitasi motor listrik, toko sembako, kantor pos, dll untuk pasang meteran listrik sewa dengan HET ditetapkan pemerintah atau pribadi, mohon dibantu ya pak https://t.co/SSU5SFDcr1";0;0;0;0;in;1604062702854635520;1685389548908634112;balikpapan7000;https://twitter.com/balikpapan7000/status/1685389548908634112
Sat Jul 29 18:46:04 +0000 2023;1685361062840016896;"Menhub Klaim Pendapatan Sopir Ojol Naik Berkat Motor Listrik, SPAI Ungkap Sebaliknya #TempoBisnis https://t.co/E8vl4Ia9Vh";4;25;9;26;in;18129942;1685361062840016896;tempodotco;https://twitter.com/tempodotco/status/1685361062840016896
Sat Jul 29 18:41:36 +0000 2023;1685359939752181760;"Gk segampang itu jg boss @BudiKaryaS  ngomomg pndpatan ojol naik jika pkai motor listrik, muter2 cr lokasi rame order plg pergi gk ada order mlh justru tekor krn opex jd lbh tinggi atau cm hbsin bnsin/btrai. Emg cas btrai gratis dr PLN ?";0;1;0;0;in;959844538272555008;1685359936778469376;DKIJakarta69;https://twitter.com/DKIJakarta69/status/1685359939752181760
Sat Jul 29 18:35:17 +0000 2023;1685358350148743168;"gak mau gue gak mau post video OKK di first mau sampe jokowi turun tangan smbil nyogok gue pake sepeda listrik special edition seharga motor sport gak gak bakal gue post di first";0;2;0;0;in;1396475674165055489;1685358350148743168;jaeseIf;https://twitter.com/jaeseIf/status/1685358350148743168
Sat Jul 29 18:17:03 +0000 2023;1685353762419032064;"motor listrik? ketinggian &amp  jarak waktu profil jalanan? X &amp  Y grafik?";0;0;0;0;in;1131895472631701505;1685353762419032064;awanations;https://twitter.com/awanations/status/1685353762419032064
Sat Jul 29 17:55:06 +0000 2023;1685348237178466304;"@Gus_Raharjo @gibran_tweet Kalau punya perusahaan motor listrik gpp ya .?";0;0;0;3;in;549729550;1685192142703198209;iwandana1;https://twitter.com/iwandana1/status/1685348237178466304
Sat Jul 29 17:52:32 +0000 2023;1685347589263392768;"@detikcom emang bahaya banget, daerah kost sekarang bocil bocil naik sepeda listrik ngga tahu aturan. Udahlah ngga pake helm, di tengah, kebut-kebutan, gerombolan sama temen-temennya pula. ntar kalo udah kecium body mobil or motor, ortunya yang ngamok ngamok";0;4;14;255;in;480362659;1685221124831895553;durkcloudev;https://twitter.com/durkcloudev/status/1685347589263392768
Sat Jul 29 17:06:06 +0000 2023;1685335904322478080;"Masih ragu Buat beli motor listrik? Rugi banget sih. #PakaiMolisYuk  #FRABRE  ditto logo twitter syiah dp 2 taehyung for esquire korea nyuci park jongseong kebalik lgbt cuci lumpia uu ite let me #BBNaija https://t.co/Ls9rKbQ40K";0;0;0;1;in;1566964889205473281;1685335904322478080;ota_production;https://twitter.com/ota_production/status/1685335904322478080
Sat Jul 29 17:03:58 +0000 2023;1685335368093339649;"Seneng deh makin banyak gojek motor listrik";0;1;0;0;in;44578596;1685335368093339649;linkanletlora;https://twitter.com/linkanletlora/status/1685335368093339649
Sat Jul 29 16:57:40 +0000 2023;1685333783300673536;"Diskon Langsung dari Pemerintah Nih Buat Beli Motor Listrik. #PakaiMolisYuk  #FRABRE  #BBNaijaAllStars  #ม็อบ29กรกฎา66 https://t.co/0iBY1XYybW";0;0;0;1;in;1625428606574010368;1685333783300673536;rahmatpoop22;https://twitter.com/rahmatpoop22/status/1685333783300673536
Sat Jul 29 16:55:06 +0000 2023;1685333135331147776;"Ini Loh Syarat dan Ketentuan Untuk Punya Motor Listrik Sekarang. #PakaiMolisYuk  #FRABRE  ditto logo twitter syiah dp 2 taehyung for esquire korea nyuci park jongseong kebalik lgbt cuci lumpia uu ite let me https://t.co/818XI9mZOX";0;0;0;1;in;1666081681709871110;1685333135331147776;putrimonica0208;https://twitter.com/putrimonica0208/status/1685333135331147776
Sat Jul 29 16:48:04 +0000 2023;1685331367398375424;"@detikcom di WAG tau apa narasinya? 'bahaya motor listrik Meledak' ... FYUHHHHHHH JEMBAAATTT";0;2;1;7;in;761494284;1685221124831895553;fotodeka;https://twitter.com/fotodeka/status/1685331367398375424
Sat Jul 29 16:22:30 +0000 2023;1685324932455313408;"Bokong ada baret, lampu udh led, stnk mati, bpkb aman, ban blkg Zeneos baru, depan Pirelli lama, plat B, lokasi Sleman Jogja.  Harga DM* dijual krn mau ganti motor Listrik aja 😁";0;0;0;0;in;34951116;1685324790822035456;muhallala;https://twitter.com/muhallala/status/1685324932455313408
Sat Jul 29 16:11:46 +0000 2023;1685322233764249600;"@Heraloebss jangankan dipake bocil, kadang abang ojol pake motor listrik aja kaget suka tbtb nyalip";0;0;0;0;in;1241330430852227074;1684849364169322496;luvontheweekn;https://twitter.com/luvontheweekn/status/1685322233764249600
Sat Jul 29 15:19:47 +0000 2023;1685309151419998208;"Dan akhirnya gua beli kabel data di mengwi mana harga nya 30rb ajg tapi gpp daripada hp gua mati sebelum nympe dps:(( trs untung nya lgi motor gue motor listrik jadi bisa ngecas di motor 😭🙏🏻";0;0;0;0;in;1544567987415715840;1685309151419998208;coriouskiddo;https://twitter.com/coriouskiddo/status/1685309151419998208
Sat Jul 29 15:17:03 +0000 2023;1685308463478632448;"Kapan yo.. ada motor portable😔..  Konsepnya kek sepeda lipat. Ga riweuh cari parkiran ngabisin lahan. Tinggal lipet masukin tas atau tekan tombol clingg muncul  Bahan bakarnya pake tenaga suryaa atau charger listrik";0;2;0;5;in;1287177274815442944;1685308463478632448;iammedysk;https://twitter.com/iammedysk/status/1685308463478632448
Sat Jul 29 15:12:45 +0000 2023;1685307381151113216;"cok motor listrik tarikannya enak banget, rasanya kayak terbang bukan naik motor";0;0;0;0;in;1195188215512104964;1685307381151113216;seragamlengkap;https://twitter.com/seragamlengkap/status/1685307381151113216
Sat Jul 29 15:11:51 +0000 2023;1685307152171163649;"Kementerian Energi dan Sumber Daya Mineral (ESDM) mengungkap sejak 27 Juli 2023 sudah 4.578 pemohon konversi motor listrik. https://t.co/y7byNi9JCO";0;0;0;0;in;135795460;1685307152171163649;detikfinance;https://twitter.com/detikfinance/status/1685307152171163649
Sat Jul 29 14:52:53 +0000 2023;1685302381205225472;"Motor listrik sekarang lebih terjangkau dan ada potongan harga juga. Nih ada cara dan syaratnya!  #PakaiMolisYuk Kevin Putri Ariani Goodbye Twitter LALISA SHINES VIETNAM Burung Narnia Jungkook DP 2 #ohmpawat Malam Minggu Suchwita Criminal Love https://t.co/Z6QhA9cqo1";0;0;0;2;in;1580792634305523713;1685302381205225472;ArunaKhanza;https://twitter.com/ArunaKhanza/status/1685302381205225472
Sat Jul 29 14:52:07 +0000 2023;1685302187159932928;"Simak nih cara buat dapetin potongan harga saat pembelian motor listrik, biar harganya makin terjangkau  #PakaiMolisYuk Kevin Putri Ariani Goodbye Twitter LALISA SHINES VIETNAM Burung Narnia Jungkook DP 2 #TwitterBird Malam Minggu Suchwita Criminal Love https://t.co/4n4ma0VSJb";0;0;0;2;in;1580155848252268544;1685302187159932928;AmaraZoe5;https://twitter.com/AmaraZoe5/status/1685302187159932928
Sat Jul 29 14:51:07 +0000 2023;1685301934184607744;"Nih syarat dan ketentuan buat pembelian motor listrik dengan tambahan diskon buat dapetin harga yang terjangkau  #PakaiMolisYuk Kevin Putri Ariani Goodbye Twitter LALISA SHINES VIETNAM Burung Narnia Jungkook DP 2 #EXOSC_WaterBomb Malam Minggu Suchwita Criminal Love https://t.co/coB4xKF6gS";0;0;0;2;in;1580154754130247680;1685301934184607744;EldenNadin;https://twitter.com/EldenNadin/status/1685301934184607744
Sat Jul 29 14:50:41 +0000 2023;1685301825476636672;"@tanyarlfes Adikku yg pertama dia serba bisa. Asli dia bisa betulin listrik, bisa betulin pompa air,betulin kipas, adikku lincah banget dari kecil,dia tk udah bisa bawa sepeda roda 2,pas sd tiba tiba dia dah bisa bawa motor kopling, smp dia dah bisa bawa mobil manual😭";0;1;0;0;in;1059888547;1685287300115361792;misianterpaket;https://twitter.com/misianterpaket/status/1685301825476636672
Sat Jul 29 14:47:35 +0000 2023;1685301047068385280;"Rame jasa malam minggu di Alun-alun Tigaraksa, Kabupaten Tangerang yang dijadikan venue MTQ ke-20 Provinsi Banten. Banyak wahana pasar malam, jajanan, dan mobil-mlbilan, sepeda, dan motor listrik untuk anak-anak. https://t.co/3OSf6eMxB2";0;0;0;4;in;2818687488;1685301047068385280;AboutTNG;https://twitter.com/AboutTNG/status/1685301047068385280
Sat Jul 29 14:41:13 +0000 2023;1685299442113548288;"Hai teman-teman! Kini hadir Greentech Scood, skuter listrik yang stylish, praktis, dan ramah lingkungan! Tertarik? Lihat review lengkapnya di sini: https://t.co/02ox79w0W9. Jangan sampai ketinggalan! #MotorListrik #ScooterListrik #GreentechScood https://t.co/AhXxKj9s5W";0;0;0;0;in;615964857;1685299442113548288;androidPonsel_;https://twitter.com/androidPonsel_/status/1685299442113548288
