created_at;id_str;full_text;quote_count;reply_count;retweet_count;favorite_count;lang;user_id_str;conversation_id_str;username;tweet_url
Fri Jul 28 14:12:46 +0000 2023;1684929898123759616;"@sedepenak Tapi iseh rodo serem bocil kematian sepeda listrik. Kui angger start jam 4 sore wes sliwar sliwer. Durung le nganggo motor tril listrik bocil. Walau lokalis tapi nang daerahku wes se njelei kui";0;0;0;0;in;1335880988824461312;1684921571218210818;rasarabu;https://twitter.com/rasarabu/status/1684929898123759616
Fri Jul 28 14:07:20 +0000 2023;1684928528377348097;"@rasarabu Motor listrik ki yo ngeri jane, rak krungu suara mesine. Ujug ujug lewat";0;1;0;0;in;119664634;1684921571218210818;sedepenak;https://twitter.com/sedepenak/status/1684928528377348097
Fri Jul 28 14:05:49 +0000 2023;1684928146225917953;"motor listrik kalo rusak dibawa ke PLN kah bang??";0;2;0;0;in;1432321748;1684928146225917953;PrasBay;https://twitter.com/PrasBay/status/1684928146225917953
Fri Jul 28 14:03:46 +0000 2023;1684927630666235904;"@darkkpol Harganya 655k  incl. Wifi, listrik, dapur dan gas kompornya. Kamar lumayan gede ada ranjang +kasur, meja, kursi, lemari, 24 jam, KM luar, jemuran, parkiran motor.  Minusnya pintunya old style👌";0;1;0;0;in;1489967521264406529;1684895967617978368;dlwdrma;https://twitter.com/dlwdrma/status/1684927630666235904
Fri Jul 28 14:00:02 +0000 2023;1684926691477803008;"Pemerintah Gelar Konversi Sepeda Motor Listrik Perdana, 100 Unit Bakal Dikonversi https://t.co/11zGiEWjXn";0;0;0;0;in;30617522;1684926691477803008;WartaEkonomi;https://twitter.com/WartaEkonomi/status/1684926691477803008
Fri Jul 28 13:57:51 +0000 2023;1684926141520580608;"Motor listrik jadi kendaraan masa kini, kamu bisa cek molis lewat aplikasi PLN mobile  #PakaiMolisYuk #MaineMendoza #ArjosMaineEvent #SenzoMeyiwaTrial https://t.co/dpdcIbwawD";0;0;0;2;in;1616024470053064707;1684926141520580608;KemisHadi;https://twitter.com/KemisHadi/status/1684926141520580608
Fri Jul 28 13:57:44 +0000 2023;1684926111325843456;"@Heraloebss Ini di daerah perantauan gua banyak yg pake sepeda listrik. Bocil2 dari yg bawa sendirian, bocengan, sampai bonceng tiga juga gk kalah banyak. Mana bikin kita pengguna motor jadi ngerasa kagok kalau ketemu. Dah jadi trend baru kayanya disini, kalah gapunya sepeda listrik gk keren";0;0;0;0;in;1246515037688090624;1684849364169322496;IkiEman_78;https://twitter.com/IkiEman_78/status/1684926111325843456
Fri Jul 28 13:56:32 +0000 2023;1684925813039484928;"Seluruh pihak terkait harus memasifkan kampanye konversi motor konvensional menjadi motor listrik supaya kuota insentif Rp7 juta per unit tahun ini bisa tercapai https://t.co/OomJ2NaYyw";0;0;0;0;in;874558344593195008;1684925813039484928;validnewsid;https://twitter.com/validnewsid/status/1684925813039484928
Fri Jul 28 13:49:23 +0000 2023;1684924013376897025;"@Heraloebss Sepeda listrik itu langsung ngacir klo digas udh Kya motor pakai gas spontan, dan bahayanya lagi ngga ada suara seakan tidak ada tanda2 keberadaan saran memang harus sering main klakson";0;0;0;0;in;60271035;1684849364169322496;fadillahMAD_7;https://twitter.com/fadillahMAD_7/status/1684924013376897025
Fri Jul 28 13:48:32 +0000 2023;1684923799383482368;"Bidik 50 Ribu Unit Konversi Motor Listrik di Tahun Ini, Menteri ESDM: Insya Allah #TempoBisnis https://t.co/Bl3UdHJkdl";0;2;1;2;in;18129942;1684923799383482368;tempodotco;https://twitter.com/tempodotco/status/1684923799383482368
Fri Jul 28 13:47:37 +0000 2023;1684923566482219008;"Dengan banyaknya yang beralih ke motor listrik, bisa membantu mengurangi polusi udara #PakaiMolisYuk #BersihPakaiMolis  Jisoo G.O.A.T Haaland Cat 1 Manchester She Hulk Butut Jurusan https://t.co/IW3Kf4qJ3E";0;0;0;1;in;1574754287976353792;1684923566482219008;NicoleG45244478;https://twitter.com/NicoleG45244478/status/1684923566482219008
Fri Jul 28 13:46:22 +0000 2023;1684923251699712001;"Motor listrik merupakan kendaraan yang ramah lingkungan karena tidak menghasilkan emisi langsung saat beroperasi  #PakaiMolisYuk #PraktisPakaiMolis  Jisoo G.O.A.T Haaland Cat 1 Manchester She Hulk Butut Jurusan https://t.co/Bimx2jk9IX";0;0;0;1;in;1579731243263934466;1684923251699712001;Catheri57762187;https://twitter.com/Catheri57762187/status/1684923251699712001
Fri Jul 28 13:45:07 +0000 2023;1684922938494214145;"Motor listrik memiliki banyak keunggulan, salah satunya bisa membantu menghemat pengeluaran dan meringankan pajak #PakaiMolisYuk #HematPakaiMolis  Jisoo G.O.A.T Haaland Cat 1 Manchester She Hulk Butut Jurusan https://t.co/VQllfzvAu4";0;0;0;1;in;1591135681102761984;1684922938494214145;heyking_xone;https://twitter.com/heyking_xone/status/1684922938494214145
Fri Jul 28 13:44:07 +0000 2023;1684922684881379328;"Download aplikasi PLN mobile untuk mempermudah kamu untuk cari motor listrik  #PakaiMolisYuk #DDReturns #REBOOT #MaineMendoza https://t.co/ScbMv3PC3X";0;0;0;1;in;1615747829422764033;1684922684881379328;el_raffasya;https://twitter.com/el_raffasya/status/1684922684881379328
Fri Jul 28 13:44:05 +0000 2023;1684922679147827200;"Beralih ke motor listrik menjadi salah satu cara terbaik untuk mengurangi emisi karbon di Indonesia #PakaiMolisYuk #PakaiMolis  Jisoo G.O.A.T Haaland Cat 1 Manchester She Hulk Butut Jurusan https://t.co/ojeHEBPyoN";0;0;0;1;in;1580511975355752449;1684922679147827200;sikingso;https://twitter.com/sikingso/status/1684922679147827200
Fri Jul 28 13:41:04 +0000 2023;1684921920419217408;"Demi lingkungan yang lebih baik, yuk beralih ke motor listrik #PakaiMolisYuk #AyoPakaiEV   Jisoo G.O.A.T Haaland Cat 1 Manchester She Hulk Butut Jurusan https://t.co/rCAsKwgN7m";0;0;0;1;in;1567953000311959554;1684921920419217408;Sopian_xone;https://twitter.com/Sopian_xone/status/1684921920419217408
Fri Jul 28 13:37:04 +0000 2023;1684920912490147840;"Biaya Konversi Motor Listrik Rp 7,5-8 Jutaan Setelah Disubsidi, Begini Cara Daftarnya https://t.co/WNWWq67LrU";0;0;2;3;in;41730943;1684920912490147840;VIVAcoid;https://twitter.com/VIVAcoid/status/1684920912490147840
Fri Jul 28 13:32:18 +0000 2023;1684919711300239361;"@Heraloebss Sepeda listrik tuh itungannya motor motor juga ya?";0;1;0;0;in;1609673290523770880;1684849364169322496;uknowmeaf;https://twitter.com/uknowmeaf/status/1684919711300239361
Fri Jul 28 13:29:26 +0000 2023;1684918991150821378;"5 PVC Liella Oke batal beli motor listrik";0;0;0;0;ht;235548130;1684918991150821378;Randi_Winardi;https://twitter.com/Randi_Winardi/status/1684918991150821378
Fri Jul 28 13:28:19 +0000 2023;1684918709494915073;"@Heraloebss Saya lupa foto seoramg bapak dgn anak kecil bersepeda listrik di jalan Minangkabau Raya  Sesuai permenhub 45 ga kuat,karma diduga ga pakai sanksi. Driver bapak ini akali sepeda pakai bunyi keras, jadi waspadai motor lain  Di Rw03 #cempakaputihtimur jg beberapa bsepeda listrik";0;0;0;1;in;1657712299350827008;1684849364169322496;JimnManopo51051;https://twitter.com/JimnManopo51051/status/1684918709494915073
Fri Jul 28 13:27:21 +0000 2023;1684918466531520512;"Lebih hemat dan ramah lingkungan, motor listrik emang keren dehh  #PakaiMolisYuk #GranHermanoChile #MaineMendoza #DDReturns #REBOOT https://t.co/PxEkjUzRYX";0;0;0;1;in;1493746481404444672;1684918466531520512;rismaaoneng;https://twitter.com/rismaaoneng/status/1684918466531520512
Fri Jul 28 13:24:03 +0000 2023;1684917638085193728;"Pemerintah menetapkan kuota subsidi konversi motor listrik di tahun ini sebanyak 50.000 unit. https://t.co/Einud70856";0;0;2;1;in;23343960;1684917638085193728;kompascom;https://twitter.com/kompascom/status/1684917638085193728
Fri Jul 28 13:23:03 +0000 2023;1684917386380800000;"Konversi motor listrik mendorong pembangunan infrastruktur pendukung, trutama pembangkit listrik EBT. https://t.co/8GJ4J84fCK";0;0;0;0;in;874558344593195008;1684917386380800000;validnewsid;https://twitter.com/validnewsid/status/1684917386380800000
Fri Jul 28 13:13:33 +0000 2023;1684914995136696320;"Motor Listrik, Menteri Arifin: Hasilkan Bisnis hingga Rp1.000 Triliun https://t.co/g2TKJRBvY8";1;5;2;5;in;46693036;1684914995136696320;inilahdotcom;https://twitter.com/inilahdotcom/status/1684914995136696320
Fri Jul 28 13:13:05 +0000 2023;1684914877759213568;"Bagaimana dg program konversi motor yg pakai bensin ke listrik? Ga menarik juga karena: - biayanya beda tipis dg motor listrik non konversi - hasil konversinya minim fitur panel dashboard &amp  kelistrikan yg modern yg ditawarkan motor listrik non konversi";0;0;0;0;in;26963795;1684914874252701696;aritj;https://twitter.com/aritj/status/1684914877759213568
Fri Jul 28 13:13:04 +0000 2023;1684914874252701696;"Subsidi harga motor listrik tdk menarik buat sy krn: - minim charging station - tdk ada subsidi instalasi listrik utk di rumah - motor listrik murah tdk kuat melibas tanjakan &gt  25º, apalagi berboncengan - desain &amp  kualitas motor listrik murah blm sebaik motor yg pakai bensin https://t.co/sqvjY3DvOp";0;1;0;0;in;26963795;1684914874252701696;aritj;https://twitter.com/aritj/status/1684914874252701696
Fri Jul 28 13:11:52 +0000 2023;1684914571537211392;"ESDM Catat Lebih 4.500 Permintaan Subsidi Motor Listrik Konversi https://t.co/cmqGkkHhup";0;1;4;9;in;17128975;1684914571537211392;CNNIndonesia;https://twitter.com/CNNIndonesia/status/1684914571537211392
Fri Jul 28 13:08:14 +0000 2023;1684913657275412481;"Widihhh Cebong  boleh bangga,  motor listrik  ESEMKA mulai menggelinding.";0;0;0;0;in;1272768497945178112;1684913657275412481;Virsi6;https://twitter.com/Virsi6/status/1684913657275412481
Fri Jul 28 13:06:33 +0000 2023;1684913231519985664;"Menteri ESDM: Kriteria Penerima Subsidi Motor Listrik Rp7 Juta Bakal Diperluas https://t.co/FZsHA9awDP";0;0;1;1;in;118646322;1684913231519985664;Bisniscom;https://twitter.com/Bisniscom/status/1684913231519985664
Fri Jul 28 13:05:21 +0000 2023;1684912932067704832;"@moreandmore170 bener, malah motor yg ngalah sm sepeda listrik😭";0;0;0;0;in;1262238617998520322;1684904002717351936;pentolllpedess;https://twitter.com/pentolllpedess/status/1684912932067704832
Fri Jul 28 13:04:24 +0000 2023;1684912691981484033;"BAHAYANYA KOSLETING MOTOR LISTRIK BANYAK KASUS TERBAKAR. @_qaireen084  @6undul0h  @_MbakSri_  @0M_YANT0 https://t.co/AjppBo5vi1";0;2;9;15;in;1667233216091279363;1684912691981484033;AtokBadar75777;https://twitter.com/AtokBadar75777/status/1684912691981484033
Fri Jul 28 12:55:52 +0000 2023;1684910546162974720;"@Heraloebss Kejadian serupa hampir terjadi di Lwliang, Bogor. Waktu itu ada anak-anak naik sepeda listrik ramean make sisi kanan jalan yang mana hampir bertabrakan dengan pengendara motor di lawan arahnya";0;1;1;0;in;1260342062781657089;1684849364169322496;ridwanlzd;https://twitter.com/ridwanlzd/status/1684910546162974720
Fri Jul 28 12:54:10 +0000 2023;1684910115789676544;"Menteri ESDM Arifin Tasrif bakal membahas revisi persyaratan penerima insentif kendaraan listrik Senin (28/7). Pasalnya, program konversi motor listrik sepi peminat. #bisnisupdate #update #bisnis https://t.co/sFBJqLUJ2l";0;0;2;1;in;759692754985242625;1684910115789676544;kumparan;https://twitter.com/kumparan/status/1684910115789676544
Fri Jul 28 12:54:07 +0000 2023;1684910102019792897;"Pemerintah menargetkan sebanyak 50 ribu konversi motor listrik di tahun ini. Padahal hingga semester I 2023, belum ada 5 persen motor listrik yang dikonversi. #bisnisupdate https://t.co/SdXkVgrkAx";0;0;0;0;in;759692754985242625;1684910102019792897;kumparan;https://twitter.com/kumparan/status/1684910102019792897
Fri Jul 28 12:49:06 +0000 2023;1684908839307767808;"Menteri ESDM: Konversi Motor Listrik Hasilkan Transaksi Rp 1.000 Triliun https://t.co/qxjoJq1QEv";0;0;0;2;in;47596019;1684908839307767808;liputan6dotcom;https://twitter.com/liputan6dotcom/status/1684908839307767808
Fri Jul 28 12:49:03 +0000 2023;1684908829786685440;"Menhub: Berkat Motor Listrik, Pendapatan Supir Ojol Naik https://t.co/jMLlLVSq2E";0;3;0;0;in;47596019;1684908829786685440;liputan6dotcom;https://twitter.com/liputan6dotcom/status/1684908829786685440
Fri Jul 28 12:35:05 +0000 2023;1684905315790434305;"Pemerintah menargetkan sebanyak 50 ribu konversi motor listrik di tahun ini. Padahal hingga semester I 2023, belum ada 5 persen motor listrik yang dikonversi. #bisnisupdate https://t.co/FrBnpsMt4J";1;0;0;0;in;759692754985242625;1684905315790434305;kumparan;https://twitter.com/kumparan/status/1684905315790434305
Fri Jul 28 12:30:03 +0000 2023;1684904046451433472;"@Heraloebss Meresahkan banget Bu sepeda listrik tuh karena yang make dominan anak kecil belum lagi pada kebut-kebutan. Selain itu, jadi banyak anak kecil yang bisa mengendarai motor juga. Bersyukurlah kalian yang punya anak kecil tapi takut untuk make sepeda listrik.";0;0;0;0;in;822806255009820672;1684849364169322496;esmeepika;https://twitter.com/esmeepika/status/1684904046451433472
Fri Jul 28 12:22:59 +0000 2023;1684902270813761536;"@Heraloebss sy pake sepeda listrik terus pake helm dijalan raya, banyak yg liatin  mungkin bagi mreka aneh naik sepeda pake helm padahal hrs disamain antara sepeda listrik sm motor ketika berkendara di jalan raya, untuk safety";0;0;0;1;in;99427000;1684849364169322496;ADIcted19;https://twitter.com/ADIcted19/status/1684902270813761536
Fri Jul 28 12:14:15 +0000 2023;1684900069064220672;"@Heraloebss Sepeda listrik dan motor listrik sangat berbahaya karena tidak punya suara, sehingga rawan sekali ketabrak orang dan di tabrak kandaraan lain.";0;0;0;0;in;1430876954043977731;1684849364169322496;Bahrunehbos;https://twitter.com/Bahrunehbos/status/1684900069064220672
Fri Jul 28 12:11:38 +0000 2023;1684899412353671169;"@Heraloebss Kendaraan listrik roda 2 semuanya berbahaya!!  imo, karena mental pengendaranya.  Mereka berlagak seolah sepeda motor, nikung sana sini. Padahal kendaraan bermotor dan listrik itu BEDA 1. Ga ada suara, senyap 2. Ga ada lampu (mostly)  Bikin ga trlalu sadar ada dia di sebelah";0;1;0;7;in;1223647458;1684849364169322496;lullabwe;https://twitter.com/lullabwe/status/1684899412353671169
Fri Jul 28 12:02:27 +0000 2023;1684897099958403072;"@Heraloebss Sepeda listrik &amp  sepeda motor adalah sama-sama kendaraan bermotor.";0;0;0;0;in;89699871;1684849364169322496;rizkres;https://twitter.com/rizkres/status/1684897099958403072
Fri Jul 28 12:01:07 +0000 2023;1684896763944312832;"Ekosistem konversi motor listrik masih diperlukan koordinasi dengan berbagai pihak terkait. https://t.co/qmsIoJzSqK";0;0;0;1;in;23343960;1684896763944312832;kompascom;https://twitter.com/kompascom/status/1684896763944312832
Fri Jul 28 11:48:40 +0000 2023;1684893631080222720;"Beli motor listrik mudah dan praktis melalui aplikasi PLN Mobile selain itu motor listrik juga lebih hemat biaya operasional. #PakaiMolisYuk  Selingkuh Cat 1 Daddies G.O.A.T Jisoo Berapa Aja Ngejar Akane Cat 5 Jolly Asyura https://t.co/qg5gurkFIp";0;0;0;1;in;1357255355894435850;1684893631080222720;Glynnisptr;https://twitter.com/Glynnisptr/status/1684893631080222720
Fri Jul 28 11:46:01 +0000 2023;1684892965305712640;"Demi lingkungan yang lebih baik buruan deh beralih ke motor listrik, kini muda loh beli motor listrik melalui aplikadi PLN Mobile #PakaiMolisYuk  Selingkuh Cat 1 Daddies G.O.A.T Jisoo Berapa Aja Ngejar Akane Cat 5 Jolly Asyura https://t.co/XY3spuaBHt";0;1;0;1;in;784555574658756612;1684892965305712640;cruisefr;https://twitter.com/cruisefr/status/1684892965305712640
Fri Jul 28 11:45:52 +0000 2023;1684892927032737792;"@Lievyskinwhite mjb kak, motor listrik gini ngisi dayanya pake token kah? apa di dicharge? kira2 sebulan bisa abis berapa yaa? tia";0;0;0;0;in;1567000906834800640;1684140188891774976;fucekdeh;https://twitter.com/fucekdeh/status/1684892927032737792
Fri Jul 28 11:45:21 +0000 2023;1684892798217330688;"Mantap banget nih beli motor listrik lewat aplikasi PLN Mobile aja mudah dan praktis buruan beralih guys demi lingkungan yang lebih baik #PakaiMolisYuk  Selingkuh Cat 1 Daddies G.O.A.T Jisoo Berapa Aja Ngejar Akane Cat 5 Jolly Asyura https://t.co/h2SEaZxqqO";0;0;0;1;in;1632766895299661825;1684892798217330688;thisikooo;https://twitter.com/thisikooo/status/1684892798217330688
Fri Jul 28 11:44:50 +0000 2023;1684892667292098560;"Yuk sekarang beli motor listrik mudah loh dengan aplikasi PLN Mobile, buruan beralih demi lingkungan yang lebih baik #PakaiMolisYuk  Selingkuh Cat 1 Daddies G.O.A.T Jisoo Berapa Aja Ngejar Akane Cat 5 Jolly Asyura https://t.co/73GY6Zims5";0;0;0;1;in;1542687248;1684892667292098560;chiaraaurellie;https://twitter.com/chiaraaurellie/status/1684892667292098560
Fri Jul 28 11:44:18 +0000 2023;1684892533170593793;"Mudah banget loh beralih ke motor listrik bisa melalui Aplikasi PLN Mobile yuk beralih ke motor listrik agar lingkungan sehat bebas polusi #PakaiMolisYuk  Selingkuh Cat 1 Daddies G.O.A.T Jisoo Berapa Aja Ngejar Akane Cat 5 Jolly Asyura https://t.co/xLWBz7UBix";0;0;0;1;in;1624947242;1684892533170593793;clarettariella;https://twitter.com/clarettariella/status/1684892533170593793
Fri Jul 28 11:44:09 +0000 2023;1684892495547887617;"Kejar Target 50.000 Motor Listrik Konversi 2023, Luhut Minta BPKB dan STNK Tak Dipersulit https://t.co/tLBy2HF9Ee";0;0;0;1;in;47596019;1684892495547887617;liputan6dotcom;https://twitter.com/liputan6dotcom/status/1684892495547887617
Fri Jul 28 11:43:32 +0000 2023;1684892341625393152;"Guys yuk segera beralih ke motor listrik demi lingkungan yang lebih baik dan belinya di aplikasi PLN Mobile aja 👍 #PakaiMolisYuk  Selingkuh Cat 1 Daddies G.O.A.T Jisoo Berapa Aja Ngejar Akane Cat 5 Jolly Asyura https://t.co/uL2JPoVMTf";0;0;0;1;in;636855255;1684892341625393152;cessaazzahraa;https://twitter.com/cessaazzahraa/status/1684892341625393152
Fri Jul 28 11:42:30 +0000 2023;1684892080316026880;"@Heraloebss pernah lg santai baws motor,, tiba2 di salip bocil pake sepeda listrik dr kiri... Anjayyy.,, senyap cook ni sepeda,, mengkaget..";0;0;0;0;in;1716448507;1684849364169322496;SirNetijen;https://twitter.com/SirNetijen/status/1684892080316026880
Fri Jul 28 11:39:36 +0000 2023;1684891348959399936;"@Heraloebss Masalahnya, punya sepeda listrik tapi kelakuan kayak naik motor tapi ngerasa naik sepeda. Yg naik anak2 gapake helm, tapi kecepatan setara motor. Sebel kalo ujug2 ada yg nyalip. Soalnya ga ada suaranya kann 😩.";0;0;0;0;in;1579351872724668417;1684849364169322496;SedotanNasi;https://twitter.com/SedotanNasi/status/1684891348959399936
Fri Jul 28 11:35:47 +0000 2023;1684890389709488128;"@Heraloebss ortu ortu nganggep sepeda listrik lebih aman dari motor";0;0;0;0;in;996046413623508992;1684849364169322496;droefheiddd;https://twitter.com/droefheiddd/status/1684890389709488128
Fri Jul 28 11:35:42 +0000 2023;1684890370138882049;"Target 50 Ribu Motor Konversi ke Listrik Tidak Akan Tercapai, Begini Kata Luhut : Okezone Economy https://t.co/qncrGOPuZ7";0;0;0;0;in;305657272;1684890370138882049;ilhamiasnawi;https://twitter.com/ilhamiasnawi/status/1684890370138882049
Fri Jul 28 11:34:03 +0000 2023;1684889955938820096;"Pelaksanaan Program Konversi Sepeda Motor Listrik, Luhut Sebut Masih Perlu Perbaikan #TempoBisnis https://t.co/SbQGS19Umb";0;1;1;4;in;18129942;1684889955938820096;tempodotco;https://twitter.com/tempodotco/status/1684889955938820096
Fri Jul 28 11:32:45 +0000 2023;1684889626312577024;"@Heraloebss Sepeda ada mesin listrik, berarti jadi motor listrik";0;0;0;0;in;1516232297695313921;1684849364169322496;JoeSamsung6;https://twitter.com/JoeSamsung6/status/1684889626312577024
Fri Jul 28 11:32:32 +0000 2023;1684889574533922817;"Luhut menilai perlu kerja sama dari semua pihak agar target konversi motor listrik. #bisnisupdate #update #bisnis #text https://t.co/UFNpKuSqYo";3;1;1;1;in;759692754985242625;1684889574533922817;kumparan;https://twitter.com/kumparan/status/1684889574533922817
Fri Jul 28 11:29:22 +0000 2023;1684888775787524096;"@berry_yumafian @calllvee @Heraloebss Ini hasil didikan dari org tua yg udh ngasih izin anaknya bawa kendaraan ber”MOTOR” waktu masih smp. Dikira sepeda listrik ga ber-MOTOR.";0;1;0;0;in;128463519;1684849364169322496;Ghotslike;https://twitter.com/Ghotslike/status/1684888775787524096
Fri Jul 28 11:22:24 +0000 2023;1684887022908194816;"Ebreg kolotna kata orang sunda mah.Kayanya bangga anak bisa kendarain motor,entah motor biasa atau listrik.Banyak koq bahkan sangat banyak anak belum cukup umur berkendara di jalan raya.Bonceng 3 bahkan 4.Pd ketawa balapan.";0;0;0;1;in;2454202386;1684887022908194816;UsepRamadan_G;https://twitter.com/UsepRamadan_G/status/1684887022908194816
Fri Jul 28 11:18:30 +0000 2023;1684886039767494656;"Ini karena desain sepeda listrik dibikin seperti motor";0;1;0;0;in;15915874;1684886039767494656;gombang;https://twitter.com/gombang/status/1684886039767494656
Fri Jul 28 11:18:25 +0000 2023;1684886020356198400;"@Ghotslike @calllvee @Heraloebss Ya makanya sekarang ada sepeda listrik tolol. Itu lebih aman daripada motor. Kalo urusan ketabrak mah, sepeda biasa juga bisa ketabrak. Mikir ga sih lu?";0;1;0;0;in;1237844551;1684849364169322496;berry_yumafian;https://twitter.com/berry_yumafian/status/1684886020356198400
Fri Jul 28 11:18:21 +0000 2023;1684886003826503681;"@Heraloebss haduh haduh dulu motor sekarang sepeda listrik tapi permasalahannya dibawa sama anak bawah umur terus ugal ugalan 🙂";0;0;0;0;in;1307676797589364738;1684849364169322496;sialeale1000an;https://twitter.com/sialeale1000an/status/1684886003826503681
Fri Jul 28 11:17:45 +0000 2023;1684885851673923585;"Marak sepeda listrik dijalan raya @DivHumas_Polri juga lampu LED pd motor dan mobil bikin mata meleleh";0;0;0;0;in;756482594636652545;1684885851673923585;mus_theib;https://twitter.com/mus_theib/status/1684885851673923585
Fri Jul 28 11:16:48 +0000 2023;1684885611856224257;"Masih Bingung Mau Beli Mobil Listrik Dimana ?? Super Apps PLN Mobile Dong. #PakaiMolisYuk #الاتحاد_الترجي  #ArjosMaineEvent  #BroTheAvatar  #DDReturns  Gampang kan Beli Motor. https://t.co/wW3XMrgsPW";0;0;0;1;in;1621326179973365761;1684885611856224257;bluelock822;https://twitter.com/bluelock822/status/1684885611856224257
Fri Jul 28 11:13:37 +0000 2023;1684884812426039296;"@Heraloebss Sepeda listrik ga ada suaranya dan ngebut banget. Gw aja naik ojek online yg motor listrik, masih ngeri ngeri sedap, karena ga ada suaranya.";0;0;0;0;in;19481173;1684849364169322496;thia_w;https://twitter.com/thia_w/status/1684884812426039296
Fri Jul 28 11:13:29 +0000 2023;1684884777370099712;"Kalau Mau Hemat ya Harus Beralih ke Kendaraan Listrik Sih dari Sekarang. #PakaiMolisYuk #BroTheAvatar  #DDReturns  #BBNaija  Yuk Gengs, Pakai Motor Hemat Lingkungan Mulai dari Sekarang.! https://t.co/GBsuiCk4rM";0;0;0;1;in;1626443511230001154;1684884777370099712;rahmatpoop1;https://twitter.com/rahmatpoop1/status/1684884777370099712
Fri Jul 28 11:11:58 +0000 2023;1684884396921454592;"Kalau Mau Hemat Ya Harus Beralih ke Kendaraan Listrik Sih Mulai dari Sekarang. #PakaiMolisYuk #الاتحاد_الترجي  #ArjosMaineEvent  #BroTheAvatar  Kuy Pakai Motor Hemat Lingkungan. https://t.co/yuawYxWyA6";0;0;0;1;in;1625428606574010368;1684884396921454592;rahmatpoop22;https://twitter.com/rahmatpoop22/status/1684884396921454592
Fri Jul 28 11:10:39 +0000 2023;1684884066146103296;"@Heraloebss Oiyaa, tadi aku naik motor juga hampir nabrak bocil bawa sepeda listrik yang tiba tiba kekanan🥲 hadeuh, alhamdulillahnya aku ga ketabrak sama mobil yang dibelakang aku ya allah";0;0;0;0;in;1079535723034755072;1684849364169322496;ncii3009;https://twitter.com/ncii3009/status/1684884066146103296
Fri Jul 28 11:08:17 +0000 2023;1684883468008951808;"Beberapa Tahun ke Depan Motor Listrik Semakin Banyak Loh, Yuk Beralih Ke Kendaraan Listrik Sekarang Juga Sebelum Ketinggalan. #PakaiMolisYuk #ArjosMaineEvent  #Ukraine  #BroTheAvatar  Jangan Sampai Ketinggalan Trend ya https://t.co/4TZyh9JNIC";0;0;0;1;in;1666081681709871110;1684883468008951808;putrimonica0208;https://twitter.com/putrimonica0208/status/1684883468008951808
Fri Jul 28 11:05:15 +0000 2023;1684882704633126913;"@berry_yumafian @calllvee @Heraloebss Statement mu tolol, ampas. Seolah membenarkan penggunaan sepeda listrik buat anak kecil, juga motor. Berarti ortu mu jg ikutan tolol. Anak SMP udh diizinin bawa motor.";0;1;0;0;in;128463519;1684849364169322496;Ghotslike;https://twitter.com/Ghotslike/status/1684882704633126913
Fri Jul 28 11:04:24 +0000 2023;1684882492145434624;"Kalau Mau hemat ya harus motor listrik lah Gengs. #PakaiMolisYuk #الاتحاد_الترجي  #ArjosMaineEvent  #BroTheAvatar  #DDReturns  #Coldplay  Yakin Gak Mau Beralih??? https://t.co/UUBZhSHRpT";0;0;0;1;in;1666110519605096450;1684882492145434624;Lidyamonica08;https://twitter.com/Lidyamonica08/status/1684882492145434624
Fri Jul 28 11:01:28 +0000 2023;1684881753276911616;"@Heraloebss bocil bocil nih emang ga seharusnya dikasi beginian, kek berasa naik motor mereka nih. ugal ugalan bgt bawa sepeda listrik tuh. mana sekarang banyak bgt liat anak SD sekolah bawa sepeda listrik";0;0;0;0;in;68044253;1684849364169322496;oioipeh;https://twitter.com/oioipeh/status/1684881753276911616
Fri Jul 28 11:00:41 +0000 2023;1684881555779629056;"@_d_essert @bogorfess_ Emang ada faedahnya? Sewa sepeda listrik karena ga ada motor matic yg bisa dirental. Disebut sepeda tapi kegunaannya lebih ke motor matic. Dimaklumi karena dianggap sepeda (sesuai namanya) jadi weh ugal2an di jalan";0;0;0;0;in;1003040820499369984;1684838888102313984;biehuun;https://twitter.com/biehuun/status/1684881555779629056
Fri Jul 28 10:57:56 +0000 2023;1684880866923966464;"@Marimar_Aauw Jadi ingat bulan lalu, lg nyetir motor lihat bocil2 pake 2 sepeda listrik nubruk trus jatuh. Waktu kutolong berdiriin sepedanya, ada yg nangis keras, padahal cuma lecet.. Lah akhirnya diliatin sambil ditanyain warga. Mungkin dikira saya yg nubruk mereka 😅";0;1;1;0;in;37384168;1684877219456552960;halloarie;https://twitter.com/halloarie/status/1684880866923966464
Fri Jul 28 10:52:18 +0000 2023;1684879447353368576;"Bingung mau nyari motor listrik dimana ??  Langsung aja cek di aplikasi PLN mobile  #PakaiMolisYuk #DDReturns #BBNaija #bbrightvc #NoLimite #BroTheAvatar https://t.co/JT1OLzMGcX";0;0;0;2;in;1615746853462761475;1684879447353368576;PiwPiw8164;https://twitter.com/PiwPiw8164/status/1684879447353368576
